Category, Typical Sub-Categories / Examples
Public Utilities & Infrastructure, Water Supply, Electricity, Gas, Roads and Streets, Public Transportation
Health and Sanitation, Garbage/Waste Collection , Public Health, Animal Control, Hospital/Clinic Service issues
Law and Order / Safety, Police Service, Traffic Management issues, Safety concerns
Land and Property, Property Tax/Valuation, Illegal Construction/Encroachment, Land Record disputes, Zoning violations
Others, Any complaint that does not fit into the above categories, often requiring manual routing